initiales,festival,style_festival,date,horaire,lieu,ville,prix,genre,spectacle1,artiste1,style1,spectacle2,artiste2,style2,spectacle3,artiste3,style3,spectacle4,artiste4,style4,lien1,lien2,lien3,lien4
tu,2nd tour des élections législatives,barrage du rance,Dimanche 7,8h-18h,Dans ton bureau de vote,,0€,c,,le bruit des bottes,Finkielkraut rock,,,,,,,,,,,,,
ce,Apéro chansons,,Mercredi 3,19h30,Blue Zinc,,au chapeau,c,,,scène ouverte,,,,,,,,,,,,,
tu,Blue Dog Open Air,,Dimanche 14,16h,Parc Théodore Monod,,0€,c,,DJ SETS,,,,,,,,,,,,,,
tu,Blue Dog Open Air,,Vendredi 12,18h,Parc Théodore Monod,,0€,c,,DJ SETS,,,,,,,,,,,,,,
tu,Cortex Booking,,Jeudi 4,21h30,Le Lézard,,au chapeau,c,,Goutlaw,punk blues abusif/Australie,,,,,,,,,,,,,
zz,"Festival ""La Bonn'Zik""",,Vendredi 12,à partir de 19h,parc du château,Bonnétable,0€,c,,Tito Nabat,Jazz manouche,,Mouv'N Brass,brass band,,Rue d’la soif,rock'n'roll/java,,,,,,,
zz,"Festival ""La Bonn'Zik""",,Vendredi 19,à partir de 19h,parc du château,Bonnétable,0€,c,,Jeyo,latino swing,,Call me daddy,pop groove funky,,,,,,,,,,
zz,"Festival ""La Bonn'Zik""",,Vendredi 26,à partir de 19h,parc du château,Bonnétable,0€,c,,Grisby Band,soul fink,,La charcuterie musicale,quizz musical,,Bastringue Générale,hip hop java,,,,,,,
zz,"Festival ""La Bonn'Zik""",,Vendredi 5,à partir de 19h,parc du château,Bonnétable,0€,c,,Robin cavaillès,electro beat box,,Maracujah,reg'n'roll,,,,,,,,,,
at,Festival a tout bout d'champ #6,,Samedi 20,15h30,,Chantenay-Villedieu,21€ 1j 35€ 2j,c,,Naaman,reggae,,Bakermat,electro pop,,Elmer food beat,ch.fr.,,Hilight tribe,electro transe,,,,https://www.facebook.com/events/384417914036440
at,Festival a tout bout d'champ #6,,Vendredi 19,15h30,,Chantenay-Villedieu,20€ 1j 35€ 2j,c,,Georgio,rap,,L.E.J,ch. fr.,,LES P’TITS FILS DE JEANINE,ch. fr.,,The bleers,pop rock,,,,https://www.facebook.com/events/384417914036440
zz,Festival Bazar en ordre,Arts & musique,Dimanche 21,11h,La Citadelle des anges,Teloché,0 à 22€,c,,Hasanga,psy/indie/chill,,Robin Cavailles,beatbox/loopstation,,Antoine 4000,hip-hop du futur,,Grisby,funk/groove,,,,
zz,Festival Bazar en ordre,Arts & musique,Samedi 20,16h,La Citadelle des anges,Teloché,0 à 22€,c,,Funky District live band,funk/house/disco,,Ich Bin Wallou,jazz/punk/rock/funk/chanson française,,Pierres et Fils,fanfare toute en couleurs,,Badknife,indie dance/italo disco,,,,
tu,Festival de la Chéronne // du 12 au 28 juillet,musique de chambre et de chant lyrique,Vendredi 12,20h,,Saint-Denis-des-Coudrais,,sv,,,,,,,,,,,,,,,,
at,Festival des Garennes,,Samedi 6,18h,Salle des fêtes,Souligné-sous-Ballon,0€,c,,KILTACLOU,FANFARE ROCK,,feuille,rap electro pop,,apes o'clock,"rock cuivré, hip hop",,Koritini + DUB SILENCE,,,,,https://www.facebook.com/assodesgarennes
at,Festival le son des cuivres #12,,Samedi 6,,Espace Saugonna,Mamers,0€,c,,Miles Paraguas,,,La marcha,,,Captain Neimo & Redflag,,,,,,,,
at,Festival le son des cuivres #12,,Vendredi 5,,Espace Saugonna,Mamers,0€,c,,Krakens,fanfare,,,,,,,,,,,,,
jlb,Festival le son des cuivres #12,,Dimanche 7,19h,Espace Saugonna,Mamers,de 15 à 20€,c,,Orchestre National de Bretagne & Spanish Brass,fanfares,,,,,,,,,,,,,
tu,Festival Musica // du 2 au 21 Juillet,Le lyrique autrement,Mardi 2,20h,,,à partir de 6€,sv,,,,,,,,,,,,,,,,
at,Festival Plein champ,arts urbains,Dimanche 7,13h45,Parc du Gué de Maulny,,0€,c,,Big red,raggamuffin,,Irie ites,reggae dj set,,L'abeille hurlante,"mus. irlandaise, balkanique et bluegrass",,Teddy flow,hip hop,,,,https://pleinchamplemans.fr/pleinchamp/fichiers/uploads/2024/06/unnamed-file-3.pdf
at,Festival Plein champ,arts urbains,Samedi 6,14h,Parc du Gué de Maulny,,0€,c,,Grem's,techno house,,Sea(s)cape,concert immersif,,Nous étions une armée,rock,,Nouveau monica,electro ,,,,https://pleinchamplemans.fr/pleinchamp/fichiers/uploads/2024/06/unnamed-file-3.pdf
at,Festival Plein champ,arts urbains,Vendredi 5,16h,Parc du Gué de Maulny,,0€,c,,Pat Kalla & le super Mojo,afrobeat,,Myra,"r'n'b, neo soul",,I-neige,pop rock,,Slobodan experiment,surf balkan,,,,https://pleinchamplemans.fr/pleinchamp/fichiers/uploads/2024/06/unnamed-file-3.pdf
MG,Festival Rocka'Vib,,Samedi 6,19h,parking Quai des Arts,Vibraye,"0€, camping municipal gratuit",c,,Les Skalators,ska,,Pas le Vendredi,rock,,Celkilt,rock cetlique,,,,,,,
MG,La Belle Virée,Arts de rue,Dimanche 21,16h,Stade,Louplande,0€,sv,L'imprévu sidéré,Cie La Voie Ferrée,cirque,Ze New Bamboche,Les Frères Jacquard,disco/pop/rock 70’ 80’,,TAMBORES SOCIAL CLUB,batucada,,,,,,exposition et ateliers,
MG,La Belle Virée,Arts de rue,Samedi 20,16h,Parc de la salle des fêtes,Chemiré-le-Gaudin,0€,sv,La Montagne,cie Les Vrais Majors,th. de rue,,MOUV’N BRASS,fanfare,,LES MI-GRATTEURS,"mus. balkan & irlandaise, jazz, ",,,,,,exposition et ateliers,
MG,La Belle Virée,Arts de rue,Vendredi 19,17h,Ecole élémentaire,Fillé,0€,sv,Zic Zap,Cie Ernesto Barytoni,th. musical,Haute Heure,Cie Barolosolo,cirque,,LES MISTINGUETTES,ch. fr.,,,,,,exposition et ateliers,
tu,Le bal du Vieux Mans,coorga le Pilier Rouge & Local Art Factory,Samedi 13,19h30,Square Dubois,,0€,c,,DJ's SOCIAL CLUB & Guests,,,,,,,,,,,,,,
zz,Le Mans Plage,,Vendredi 5,17h30,Allée des Prairies de Funay,,0€,sv,Les rendez-vous contes de l'été,théatre du Passeur,conte & musique,,,,,,,,,,,,,
zz,Le Mans Plage,,Samedi 13,17h30,Allée des Prairies de Funay,,0€,c,,Braz'Auréoles,batucada,,,,,,,,,,,,,
zz,Le Mans Plage,,Samedi 20,17h30,Allée des Prairies de Funay,,0€,c,,Batuk'en scène,,,,,,,,,,,,,,
zz,Le Mans Plage,,Samedi 27,17h30,Allée des Prairies de Funay,,0€,c,,Batuk'en scène,,,,,,,,,,,,,,
zz,Le Mans Plage,,Samedi 6,17h30,Allée des Prairies de Funay,,0€,c,,Musiko'Métis,,,,,,,,,,,,,,
jlb,Les Affranchis,Arts de la rue,Vendredi 5,14h,Cour Ecole Saint-Jacques,La Flèche,0€,sv,Pyrame & Thisbé,Cie les assoifés d'azur,Théâtre amateur,,,,,,,,,,,,,
jlb,Les concerts des Affranchis,orga. La Flèche Not Dead,Vendredi 5,19h30,Parc des Carmes,La Flèche,0€,c,,Midle Child,indie rock,,Feu,punk rock,,Big Red,raggamuffin,,DJ Loule Rave Box & Nikko Del Barrio ,House techno groovy,,,,
jlb,Les concerts des Affranchis,orga. La Flèche Not Dead,Samedi 6,20h,Parc des Carmes,La Flèche,0€,c,,MADAM,rock,,Tambores social club,batucada,,Didier Super & son groupe discount,"rock ""humoristique""",,DRIFT PUNK ,mega show endurance,,,,
jlb,Les concerts des Affranchis,orga. La Flèche Not Dead,Dimanche 7,20h,Parc des Carmes,La Flèche,0€,c,,PENICHE,Rock Noise instrumental ,,,,,,,,,,,,,
tu,Les Mardis de la Chanson,tous les mardis du 9 juillet au 27 août,Mardi 9,20h30,Île aux Planches,,0€,c,,,,,,,,,,,,,,,,
jlb,Les veillées,,Samedi 20,18h,Théâtre de Chaoué,Allonnes,0€,sv,Zaï Zaï Zaï Zaï,Collectif Jamais trop d'art,th. de rue,,,,,,,,,,,,,
jlb,Les veillées,,Samedi 27,18h,Théâtre de Chaoué,Allonnes,0€,sv,Queen A Man,Cie Ô Captain mon Capitaine,,,,,,,,,,,,,,
pl,Les vendredis de Bois Doublé,,Vendredi 12,19h,Chateau de Bois Doublé,Saint-Célerin,0€,c,,Easy Strike,Rock,,,,,,,,,,,,,
pl,Les vendredis de Bois Doublé,,Vendredi 5,19h,Chateau de Bois Doublé,Saint-Célerin,0€,c,,Brassens,chanson française,,,,,,,,,,,,,
tu,Les Z’arts sur l’herbe,"retraite aux flambeaux, spectacle de feu, feu d’artifice et bal populaire",Samedi 13,20h,Parc de l’Huisne,Champagné,0€,sv,,,,,,,,,,,,,,,,
tu,ONLY WAX #40 // SUMMER SESSION,,Samedi 13,21h-4h,Le Barouf,,0€,c,,ONLY WAX Team feat. Chris Unik,hip hop/grooves/funk/soul/disco,,,,,,,,,,,,,
pl,Pique nique,,Dimanche 7,12h-18h,Chateau de la Foreterie,Allonnes,0€,c,,MoviMiento ,Fanfare,,,,,,,,,,,,,
zz,soirée guinguette,,Samedi 6,19h,,Ardenay-sur-Mérize,0€,c,,Les habits du dimanche,chanson française,,,,,,,,,,,,,
zz,Soirs d'été,Arts de la rue,Jeudi 18,18h30-21h45,terrain de sport école prim. les Ardriers,,0€,sv,,,spectacles et fanfare chorégraphiée,,,,,,,,,,,,,
zz,Soirs d'été,Arts de la rue,Jeudi 25,18h30-22h30,Place du marché des Sablons,,0€,sv,,,Spectacles & concert,,,,,,,,,,,,,
zz,Soirs d'été,Arts de la rue,Vendredi 12,18h30-23h,Jardins de la cathédrale & jet d'eau,,0€,sv,,,Spectacles & concert,,,,,,,,,,,,,
zz,Soirs d'été,Arts de la rue,Vendredi 19,18h30-21h45,Parc Théodore Monod,,0€,sv,,,spectacles et fanfare chorégraphiée,,,,,,,,,,,,,
zz,Soirs d'été,Arts de la rue,Vendredi 26,18h30-22h,Parc de Tessé,,0€,sv,,,Spectacles & musique,,,,,,,,,,,,,
jlb,Superphoenix (Radio Alpa) souffle ses 35 bougies,,Samedi 20,20h,Bistro Broc Café,Changé,au chapeau,c,,Yves Caillon et Philippe Morin + invités,rock,,,,,,,,,,,,,
ce,Tempo,,Mercredi 24,20h,Blue Zinc,,tnc,c,,,scène ouverte + Jam,,,,,,,,,,,,,
ce,,,Jeudi 4,20h,Blue Zinc,,au chapeau,c,,,Boeuf Bal Folk (musique et danse),,,,,,,,,,,,,
jlb,,,Samedi 6,19h,le Café de la Gare,Chenu,0€,c,,,Scène ouverte (tous les samedis),,,,,,,,,,,,,
zz,,,Dimanche 14,11h,Local des As,,0€,c,,C4,punk rock explosif,,,,,,,,,,,,,
MG,,,Dimanche 14,16h,Moulinsart,Fillé,0€,c,,Toca de ouriço,concert de choro,,,,,,,,,,,,,
MG,,,Dimanche 28,16h,Moulinsart,Fillé,0€,c,,Swing acoustic project,tribute to Reinhardt & Grappelli,,,,,,,,,,,,,
MG,,,Dimanche 7,16h,Moulinsart,Fillé,0€,c,,OWA,pop trip-hop,,,,,,,,,,,,,
ce,,,Jeudi 11,21h,Blue Zinc,,au chapeau,c,,,mus.irlandaise acoustique,,,,,,,,,,,,,
jlb,,,Mardi 2,20h,Bistro Broc Café,Changé,au chapeau,c,,"soirée musicale avec Frédéric, Véro & Kévin",,,,,,,,,,,,,,
jlb,,,Mardi 23,20h,Bistro Broc Café,Changé,au chapeau,c,,Scène ouverte avec Yves,,,,,,,,,,,,,,
jlb,,,Mardi 9,20h,Bistro Broc Café,Changé,au chapeau,c,,Scène ouverte avec Antoine,,,,,,,,,,,,,,
jlb,,,Mercredi 17,20h,Bistro Broc Café,Changé,au chapeau,c,,Louis,,,,,,,,,,,,,,
jlb,,,Mercredi 3,20h,Bistro Broc Café,Changé,au chapeau,c,,Paloma,,,,,,,,,,,,,,
jlb,,,Samedi 13,20h,Bistro Broc Café,Changé,au chapeau,c,,Louis,,,,,,,,,,,,,,
zz,,,Samedi 13,19h,Guinguette des Tanneries,,0€,c,,Jazz kiss,jazz electro,,,,,,,,,,,,,
tu,,,Samedi 13,20h,Le Lapin Blanc,,0€,c,,Paul,rock cover,,,,,,,,,,,,,
tu,,,Samedi 13,20h30,Le Zoo,,au chapeau,c,,Didier 'n co,blues,,,,,,,,,,,,,
ce,,,Samedi 20,20h30,Blue Zinc,,au chapeau,c,,Kirjava,rock inst.,,,,,,,,,,,,,
zz,,,Samedi 20,19h,Guinguette des Tanneries,,0€,c,,Alex De Vries,trio jazz manouche,,,,,,,,,,,,,
jlb,,,Samedi 27,20h,Bistro Broc Café,Changé,au chapeau,c,,RUBik's,,,,,,,,,,,,,,
ce,,,Samedi 27,20h30,Blue Zinc,,au chapeau,c,,Onze,cover rock,,,,,,,,,,,,,
jlb,,,Samedi 6,20h,Bistro Broc Café,Changé,au chapeau,c,,Les copains de la lune,,,,,,,,,,,,,,
jlb,,,Samedi 6,20h30,Eglise saint Brice,Courcival,Entrée libre,c,,,Concert aux chandelles,,,,,,,,,,,,,
zz,,,Samedi 6,20h,Kiosque musical,Spay,0€,c,,Elle et Ils,ch. fr. d'hier et d'aujourd'hui,,BL’OCKBAND,Bluesrock,,,,,,,,,,
jlb,,,Vendredi 12,20h,Bistro Broc Café,Changé,au chapeau,c,,Pascal Lenarth,,,,,,,,,,,,,,
ce,,,Vendredi 12,20h30,Blue Zinc,,au chapeau,c,,Underfuse,rock,,,,,,,,,,,,,
tu,,,Vendredi 12,20h,Le Lapin Blanc,,0€,c,,Azuryte,électrofolk,,,,,,,,,,,,,
jlb,,,Vendredi 19,20h,Bistro Broc Café,Changé,au chapeau,c,,Timothé & Renaud Wagenard,,,,,,,,,,,,,,
jlb,,,Vendredi 19,20h,Cour du Carroi,La Flèche,0€,c,,Liybob,Swing Reggae,,Trio Bonnin Campino Laplanche,Bal à danser,,,,,,,,,,
tu,,,Vendredi 19,20h,Le Lapin Blanc,,0€,c,,Manu K,blues,,,,,,,,,,,,,
jlb,,,Vendredi 26,20h,Bistro Broc Café,Changé,au chapeau,c,,Ghislaine & Fabrice,,,,,,,,,,,,,,
tu,,,Vendredi 26,21h,Centre Beaulieu,,5 à 15€,c,,Anja Loma & Solinca,musique et peinture en direct,,,,,,,,,,,,,
jlb,,,Vendredi 26,20h,Cour du Carroi,La Flèche,0€,c,,Des Lions pour des Lions,Rock jazz fusion,,Alpha Centauri,Electro psyché Cuivré,,,,,,,,,,
zz,,,Vendredi 26,19h,Guinguette des Tanneries,,0€,c,,Azuryte,musique pop folk 60-70,,,,,,,,,,,,,
tu,,,Vendredi 26,20h,Le Lapin Blanc,,0€,c,,Eli'Jazz,duo jazz swing,,,Jam session,,,,,,,,,,
jlb,,,Vendredi 5,20h,Bistro Broc Café,Changé,au chapeau,c,,Lolipop,,,,,,,,,,,,,,
zz,,,Vendredi 5,20h30,derrrière l'Eolienne,Arnage,0€,c,,Teklash,percussions corporelles & chants,,,,,,,,,,,,,
zz,,,Vendredi 5,19h,Guinguette des Tanneries,,0€,c,,Roda Cozinha,musique latine,,,,,,,,,,,,,
zz,,,Vendredi 5,20h,HangArt,Coulans-sur-Gée,libre,c,,Elle et Ils,ch. fr. d'hier et d'aujourd'hui,,,,,,,,,,,,,
tu,,,Vendredi 5,20h,La pince à vélo,Teloché,0€,c,,djazarad,soul pfunk,,,,,,,,,,,,,
tu,,,Vendredi 5,22h-4h,Le Barouf,,0€,c,,"Blast (ext. mix) feat. ORION, PACO RABANNE & SAM VAN DER TOURE","house, minimal, deep",,,,,,,,,,,,,
tu,,,Vendredi 5,20h,Le Lapin Blanc,,0€,c,,John Maine,rock cover,,,,,,,,,,,,,
jlb,,,Mercredi 10,20h30,Chapiteau promenade Newton,,0€,sv,Le grand bal de l’été,Cie La Piste à Dansoire,bal,,,,,,,,,,,,,
tu,,,Dimanche 7,17h,Les Moulins de Paillard,Poncé-sur-le-Loir,5€,sv,Deuxième Livre de madrigaux,Ensemble Offrandes,Création 2024,,,,,,,,,,,,,
zz,,,Jeudi 11,18h30-22h,Plaine du Ronceray,,0€,sv,,,spectacles et fanfare théatralisée,,,,,,,,,,,,,
jlb,,,Lundi 1,20h30,Comédie Le Mans,,10€,sv,,,Humour en scène,,,,,,,,,,,,,
zz,,,Samedi 20,21h15,place Saint Michel/porche Royal,,8 à 12€,sv,Les Mystères dans la Cathédrale,Cie des Gens pluriels,théatre déambulatoire,,,,,,,,,,,,,
zz,,,Samedi 27,21h15,place Saint Michel/porche Royal,,8 à 12€,sv,Les Mystères dans la Cathédrale,Cie des Gens pluriels,théatre déambulatoire,,,,,,,,,,,,,
jlb,,,Vendredi 19,18h30,Cité du cirque,,0€,sv,Sortie de résidence au Plongeoir,Cie La Contrebande,cirque,,,,,,,,,,,,,
tu,,,Vendredi 19,20h,La Fonderie,,0€,sv,Musiques d’après les poésies de Dionisio Cañas,Ensemble Offrandes & Académie des jeunes compositeurs et compositrices,mus. contemporaine,,,,,,,,,,,,,
zz,,,Vendredi 19,21h15,place Saint Michel/porche Royal,,8 à 12€,sv,Les Mystères dans la Cathédrale,Cie des Gens pluriels,théatre déambulatoire,,,,,,,,,,,,,
zz,,,Vendredi 26,21h15,place Saint Michel/porche Royal,,8 à 12€,sv,Les Mystères dans la Cathédrale,Cie des Gens pluriels,théatre déambulatoire,,,,,,,,,,,,,
